publishedAt,title,description,url,sentiment
2025-07-23T21:57:24Z,Lady Raiders to play for gold medal on Friday,"Team USA, represented by Texas Tech, will play the People's Republic of China for the gold medal on Friday.",https://www.kcbd.com/2025/07/23/lady-raiders-play-gold-medal-friday/,0.0
2025-07-23T22:00:00Z,Last Hades 2 Early Access Patch Is 11,Supergiant Games announced that Patch 11 is the true final patch before Hades 2 leaves the early access phase and enters its full 1.0 release. Most additions involved Nocturnal Arms and the Boons & Blessings present in the game. The developer also noted that …,https://www.siliconera.com/last-hades-2-early-access-patch-is-11/,0.05
2025-07-23T22:00:06Z,Bitcoin Evolution: From A Tech Asset To Digital Gold Standard – Anthony Scaramucci,"Institutional and retail interest in Bitcoin, the largest digital currency, has risen to a remarkable level as the asset gains mainstream recognition in the financial sector. What was once the domain of early adopters and tech-savvy investors is now being emb…",https://bitcoinist.com/bitcoin-evolves-to-digital-gold/,0.0
2025-07-23T22:01:51Z,Introducing: The David Candaux DC7 Blue Hawk,"If David Candaux is a new name for you in watchmaking, you’re probably not alone! I hadn’t heard of him and his eponymous brand before March. Fortunately, Phillips held an event in London featuring a handful of up-and-coming Haute Horlogerie independents. It …",https://www.fratellowatches.com/introducing-the-david-candaux-dc7-blue-hawk/,0.0
2025-07-23T22:05:08Z,Booster Gold: Danny McBride Dropped Out of DC’s HBO Max Series,"Booster Gold is no longer in Danny McBride‘s future. David Jenkins, creator of HBO Max’s Our Flag Means Death, confirmed Wednesday’s news that he’s been tapped to write the pilot episode of the DC Studios series about the time-hopping hero from the 25th centu…",http://comicbook.com/tv-shows/news/booster-gold-danny-mcbride-drops-out-dc-studios-hbo-max-pilot-david-jenkins/,0.0
2025-07-23T22:12:48Z,3Quency Sang in the Rain and Performed Sick on Building the Band,"‘Building the Band’ stars 3Quency on how they went so far: “We got what it takes, and we will push harder and harder — not only our own boundaries as individuals, but as a group,” says Brianna Mazzola.",http://www.vulture.com/article/who-won-building-the-band-3quency-interview.html,-0.7142857142857143
2025-07-23T22:15:32Z,"Afia Schwar Congratulates Sammy Gyamfi for Suing Her GH¢10M, Says She Won’t Appear in Court",social commentator Afia Schwarzenegger has congratulated the CEO of Ghana Gold Board for suing her for GH¢10 million over defamation allegations.,https://yen.com.gh/entertainment/celebrities/287794-afia-schwar-congratulates-sammy-gyamfi-suing-gh10m-wont-court/,0.0
2025-07-23T22:19:18Z,Sir Elton John set to perform at Steve Jobs’ daughter’s lavish wedding,British music superstar will perform for an hour at the wedding for $2.2 million.,https://www.nzherald.co.nz/lifestyle/sir-elton-john-set-to-perform-at-steve-jobs-daughters-lavish-wedding/HGBPKZOQNZCM5JEGOGB4EA6ZDY/,0.0
2025-07-23T22:20:50Z,bans men from women’s sports,Updated policy 'emphasizes the importance of ensuring fair and safe competition environments',https://www.wnd.com/2025/07/u-s-olympic-committee-bans-men-womens-sports/,0.0
2025-07-23T22:25:41Z,L.A.B and Stan Walker to kick off summer tour in Tauranga this December,"Aaradhna, Te Wehi and Corrella join them for the December show.",https://www.nzherald.co.nz/bay-of-plenty-times/news/lab-and-stan-walker-to-kick-off-summer-tour-in-tauranga-this-december/FQ65GUEJXVFJLGXN4LAW22BH6I/,0.0
2025-07-23T22:30:37Z,Meta’s Neural Interface Wristband Reads Your Muscle Signals to Control Computers,Meta’s Neural Interface Wristband Reads Your Muscle Signals to Control ComputersMeta has developed a neural interface wristband that detects electrical signals from your muscles to control computers without touching any device. The sEMG research device...,https://www.yankodesign.com/2025/07/23/metas-neural-interface-wristband-reads-your-muscle-signals-to-control-computers/,0.0
2025-07-23T22:34:56Z,"$40 off $300-$399.99 / $60 off $400+ Spend (Online Only, Exclusions Apply) + Delivery ($0 C&C) @ The Good Guys","This deal is back with new code Pay less with an instant online only deal Use Code: DEAL07 Ends Sunday (27th July) ~~Ends 11:59pm AEST 27/07/2025. Excludes products marked as in store only, …",https://www.ozbargain.com.au/node/916759,0.35
2025-07-23T22:40:38Z,Altius Completes Sale of 2/3 of its Silicon Gold 1.5% NSR to Franco-Nevada,"Altius Retains 0.5% NSR interest as Long-Term Portfolio Component ST. JOHN’S, Newfoundland and Labrador — Altius Minerals Corporation (TSX: ALS) (OTCQX: ATUSF) Altius Minerals Corporation (“Altius”) is pleased to announce that Altius Royalty Corporation (“ARC…",https://financialpost.com/pmn/business-wire-news-releases-pmn/altius-completes-sale-of-2-3-of-its-silicon-gold-1-5-nsr-to-franco-nevada,0.0
2025-07-23T22:54:34Z,Mickey and Minnie Rebranded: Disney Makes Bold Internal Shake-up,"Disneyland Resort has unveiled a sparkling new look for Mickey and Minnie Mouse, just in time for the 2025 holiday season. The beloved duo will debut festive outfits with a “holiday spin” on their 70th Anniversary attire when the Holidays at Disneyland Resort…",https://insidethemagic.net/2025/07/mickey-and-minnie-rebranded-disney-makes-bold-internal-shake-up-em1/,0.16666666666666666
2025-07-23T23:00:26Z,Former minister says 'stroke of a pen' enough for council takeover,Tony Simpson says it is well within the WA government's power to authorise the effective takeover of the Shire of Coolgardie by the City of Kalgoorlie-Boulder.,https://www.abc.net.au/news/2025-07-24/minister-keen-coolgardie-kalgoorlie-takeover-resolution/105562212,0.0
2025-07-23T23:00:42Z,"Ethereum Maxi Compares Bitcoin To Outdated Landlines, Reveals Why ETH Is Better","An Ethereum maxi has likened Bitcoin (BTC), the largest cryptocurrency, to an outdated “landline,” claiming Ethereum (ETH) is the superior blockchain. Calling ETH the “iPhone” of crypto, the supporter argues that its smart contract capabilities and role as a …",https://bitcoinist.com/ethereum-and-bitcoin-debate/,0.04999999999999996
2025-07-23T23:08:04Z,Geriatric Undertaker Humbles TNA Champion on WWE NXT,"Greetings, comrades! It is I, your El Presidente, reporting to you live from my luxury bunker deep beneath a defunct wrestling territory's headquarters, and do I have some delicious news for you today! Last night on WWE NXT, we witnessed what can only be desc…",https://bleedingcool.com/tv/geriatric-undertaker-humbles-tna-champion-on-wwe-nxt/,0.0
2025-07-23T23:11:00Z,Germany 0-1 Spain [AET]: Bonmatí scores late winner to set up repeat of 2023 World Cup final against England,"Spain will face England in the UEFA Women’s Euro 2025 final on Sunday [17:00 BST, 18:00 CEST] after Aitana Bonmatí’s extra-time strike saw la Roja edge past Germany in Zürich.There had been litt...",https://fromthespot.co.uk/20944/germany-0-1-spain-aet-bonmati-scores-late-winner-to-set-up-repeat-of-2023-world-cup-final-against-england/,-0.15
2025-07-23T23:15:29Z,"Burlington Square hotel, apartment, and storefronts nearly open","NBC5 News toured the first tower of the Burlington Square project downtown, which will finally fill the old mall site with a future hotel, apartments, and commercial space",https://www.mynbc5.com/article/burlington-square-apartments-ac-marriott-hotel/65490684,0.0
2025-07-23T23:20:08Z,29k-Mile 1997 Mazda MX-5 Miata M-Edition 5-Speed,"This 1997 Mazda MX-5 Miata shows 29k miles and is one of 3,000 M-Edition examples produced for the model year, all of which were finished in Marina Green over tan leather upholstery. It remained in the original owner's family care and spent much of its time i…",https://bringatrailer.com/listing/1997-mazda-mx-5-miata-70/,0.0
2025-07-23T23:35:19Z,How to Watch the 3M Open Golf Tournament Online,"The 3M Open Blaine, Minnesota kicks off today in Blaine, Minnesota. Use these streaming services to watch the tournament for free",http://www.rollingstone.com/product-recommendations/streaming/3m-open-how-to-watch-online-free-2025-livestream-golf-1235392902/,0.0
2025-07-23T23:44:11Z,Kamala Harris’ ex-lover Willie Brown warns it will be ‘difficult’ for her to win California governor’s race: ‘May not be where she should be going’,"“I do think people running for public office really ought to fit eventually where they are trying to land at. And I really do, hope, frankly, that [Harris] comes to that reality,” Brown said.",https://nypost.com/2025/07/23/us-news/kamala-harris-ex-lover-willie-brown-warns-it-will-be-difficult-for-her-to-win-california-governors-race-may-not-be-where-she-should-be-going/,0.15000000000000002
2025-07-23T23:48:11Z,"Padres, Phillies Showing Interest In Steven Kwan","The Phillies and Padres are two of the many teams that have expressed interest in Steven Kwan, reports Jon Heyman of The New York Post. Both National League contenders are known to be looking for a left field upgrade. Kwan would be one of the top hitters on t…",https://www.mlbtraderumors.com/2025/07/padres-phillies-showing-interest-in-steven-kwan.html,0.0
2025-07-23T23:49:00Z,Valley football media day: What to know about all 10 teams,"Jul. 23—SIOUX FALLS — Monday at the Sanford Pentagon, the Missouri Valley Football Conference staged its first in-person Media Day in, well, a long time. The head coach and two players from all 10 teams descended on Sioux Falls to talk about the upcoming seas…",https://www.mitchellrepublic.com/sports/college/valley-football-media-day-what-to-know-about-all-10-teams,0.0
2025-07-23T23:50:20Z,Turbocharged 2012 Wolf Racing Cars GB08,"The 2012 Wolf Racing Cars GB08 CN incorporates carbon-fiber monocoque construction and was acquired by the seller in 2023. Power comes from a turbocharged 1.6-liter Peugeot inline-four that was installed under previous ownership, while shifting is via a SL82R…",https://bringatrailer.com/listing/2012-wolf-gb08-turbo/,0.0
