publishedAt,title,description,url,sentiment
2025-07-17T01:30:00Z,Context-Responsive Architecture in Spain: 7 Projects Highlighting Material Strategies,"Andanzas y visiones españolas is the book in which Miguel de Unamuno collects his experiences during excursions through Spain's cities and countryside, accompanied by friends and colleagues. More than a precise geographical description, the text consists of n…",https://www.archdaily.com/1031789/context-responsive-architecture-in-spain-7-projects-highlighting-material-strategies,0.0
2025-07-17T01:40:02Z,ギャルが本気で作ったYogibo、爆誕。～7/17（木）より放映の創業祭新CMにも出演～,"[株式会社Yogibo]
[画像1: https://prcdn.freetls.fastly.net/release_image/18338/159/18338-159-d366ea56c3d1a79ee425f34aef315f47-1280x720.jpg?width=536&quality=85%2C75&format=jpeg&auto=webp&fit=bounds&a...",https://prtimes.jp/main/html/rd/p/000000159.000018338.html,0.0
2025-07-17T01:55:30Z,Simone Biles hints at Riley Gaines transgender feud in ESPYs award speech,Simone Biles winked at some controversy at the ESPYs.,https://nypost.com/2025/07/16/sports/simone-biles-hints-at-riley-gaines-transgender-feud-at-espys/,0.0
2025-07-17T01:56:34Z,Simone Biles dominates at 2025 ESPY's in Los Angeles,It was quite the night for the Olympian.,https://www.sportingnews.com/us/olympics/news/simone-biles-dominates-2025-espys-los-angeles/163577ff3b0401661c667ebf,0.0
2025-07-17T02:00:00Z,#558: The Greater Israel Project,"Israel has big plans for expansion, and they are not afraid to advertise it as a patch on the shoulder of the Israeli Defense Force’s uniform. The Greater Israel Project calls for the invasion of all of the neighboring countries, which is well underway, as we…",https://www.activistpost.com/558-the-greater-israel-project/,0.5
2025-07-17T02:00:00Z,‘It’s Always Sunny in Philadelphia’ Mocks ‘The Bear’ By Declaring That Cooking Is ‘The Most Serious Thing’,"Tonight, Charlie Kelly took a page out of Carmy’s book — not that he can read it",https://www.cracked.com/article_47411_its-always-sunny-in-philadelphia-mocks-the-bear-by-declaring-that-cooking-is-the-most-serious-thing.html,0.0833333333333333
2025-07-17T02:00:00Z,How BYU benefits from upheaval in the business of college sports: A comprehensive guide,BYU's athletic department budget has doubled since entering the Big 12. BYU officials speak talk about the financial state of BYU sports in the NIL era.,https://www.deseret.com/sports/2025/07/16/byu-athletic-department-finances-college-sports/,0.0
2025-07-17T02:00:00Z,"This & That: July 17, 2025","A novel centered around Impressionist artists, another novel set in Oxford when it first began to admit women, a book to provide inspiration for home decorating to nourish all of your senses, a play in London receiving high praise, a film for lovers of nature…",https://thesimplyluxuriouslife.com/ttjuly1825/,0.0
2025-07-17T02:01:17Z,Von Miller makes massive Commanders decision in free agency to chase a 3rd Super Bowl ring,The future Hall of Famer has a new home.,https://www.sportingnews.com/us/nfl/washington-commanders/news/von-miller-massive-commanders-decision-free-agency-chase-3rd-super-bowl-ring/bac746ee639781316e22df30,0.1833333333333333
2025-07-17T02:15:52Z,Economic Digest: Nepal’s Business News in a Snap,"KATHMANDU: Economic Digest offers a concise yet comprehensive overview of significant business happenings in Nepal, presented in easily digestible summaries. Nepal’s economic and infrastructure landscape showed notable developments at the close of fiscal year…",https://english.khabarhub.com/2025/17/485876/,0.2
2025-07-17T02:17:23Z,Do women really need more sleep than men? A sleep psychologist explains,"Who gets to sleep, and for how long, is a complex mix of biology, psychology and society. Here’s what we know so far.",https://theconversation.com/do-women-really-need-more-sleep-than-men-a-sleep-psychologist-explains-259985,0.35
2025-07-17T02:28:54Z,BREAKING: Honesdale's Nathan Schuman wins national freestyle wrestling title in North Dakota,"After a stellar freshman year at Honesdale, Nathan Schuman has won a gold medal at the United States Marine Corps Junior National Wrestling Championships.",https://www.tricountyindependent.com/story/sports/high-school/wrestling/2025/07/16/honesdale-wrestling-nathan-schuman-national-freestyle-championship/85252046007/,0.3
2025-07-17T02:34:55Z,"Gold dips as dollar firms, Trump's Powell remarks ease market jitters",Gold prices experienced a slight dip in early Asian trading due to a stronger dollar and easing market concerns after President Trump suggested he wouldn't dismiss Federal Reserve Chair Jerome Powell. The dollar's rise made gold more expensive for internation…,https://economictimes.indiatimes.com/markets/commodities/news/gold-dips-as-dollar-firms-trumps-powell-remarks-ease-market-jitters/articleshow/122608278.cms,0.0
2025-07-17T02:38:14Z,"Why 29Metals, CAR Group, DroneShield, and Santana Minerals shares are falling today","These shares are missing out on the good times on Thursday. But why?
The post Why 29Metals, CAR Group, DroneShield, and Santana Minerals shares are falling today appeared first on The Motley Fool Australia.",https://www.fool.com.au/2025/07/17/why-29metals-car-group-droneshield-and-santana-minerals-shares-are-falling-today/,0.0
2025-07-17T02:41:00Z,What sectors are going to have their day in the sun right now? Mihir Vora answers,"Mihir Vora of Trust MF suggests a cautious market approach. Government spending drives infrastructure, power, and telecom sectors. Rural financing shows promise. Focus shifts from large-cap and IT to domestic segments. Consumer discretionary items, like AC st…",https://economictimes.indiatimes.com/markets/expert-view/what-sectors-are-going-to-have-their-day-in-the-sun-right-now-mihir-vora-answers/articleshow/122573602.cms,0.2857142857142857
2025-07-17T02:41:49Z,Andrew Cuomo proposes mayoral control of NYC transit system — rivals say he ‘had his chance and failed to deliver’,"""Cuomo had his chance and he ruined the subway system,"" Republican mayoral candidate Curtis Sliwa said. ""Running transit is not what a mayor does. He wants to be governor.""",https://nypost.com/2025/07/16/us-news/andrew-cuomo-proposes-mayoral-control-of-nyc-transit-system-rivals-say-he-had-his-chance-and-failed-to-deliver/,-0.5
2025-07-17T02:43:43Z,Kiwi who stole $23.5m in gold and silver from his 90-year-old dad is sent to jail in US,"'Treacherous, deceitful and calculated caper' blamed on elderly man's girlfriend.",https://www.nzherald.co.nz/business/kiwi-who-stole-235m-in-gold-and-silver-from-his-90-year-old-dad-is-sent-to-jail-in-us/OJK6BW7VNVCYPOJCQBT5ER3AQU/,-0.1
2025-07-17T03:02:45Z,"Win 1 of 4 Hair, Body & Skin Care + Toilet Paper Prizes from Pure Earth + Peekapoo","FIRST PRIZE [Value: $870]

A Year’s Supply of Pure Earth’s Hair, Body & Skin Care + A Year’s Supply of Peekapoo Luxury Bamboo Toilet Paper

Inclusive of:

Pure Earth Products: x3 500ml Shampoo, x3 500ml Conditioner, x5 500ml Body Wash, x5 500ml Hand Wash, x3 …",https://www.ozbargain.com.au/node/915945,0.326984126984127
2025-07-17T03:02:57Z,Sebi to review how mutual funds value gold & silver,"Sebi is contemplating revising the valuation approach for physical gold and silver assets held by mutual funds via ETFs. The regulator proposes that AMCs utilize spot prices from domestic commodity exchanges for valuation, moving away from the current relianc…",https://timesofindia.indiatimes.com/business/india-business/sebi-to-review-how-mutual-funds-value-gold-silver/articleshow/122609327.cms,0.0
2025-07-17T03:05:04Z,ASX Penny Stock Highlights For July 2025,"The Australian market has remained flat over the past week but has shown a 6.9% increase over the last year, with earnings projected to grow by 11% annually ...",https://finance.yahoo.com/news/asx-penny-stock-highlights-july-030504598.html,0.0
2025-07-17T03:13:14Z,Dua Lipa’s One-Off Porsche 911 GT3 RS Heads to Auction,"SummaryOne-off Porsche 911 GT3 RS designed by Dua Lipa for charityFeatures custom livery, Weissach Package and 518 hp flat-six engineAuction proceeds support Kosovo’s Sunny Hill Foundation and arts initiativesPop icon Dua Lipa has teamed up with Porsche to cr…",https://hypebeast.com/2025/7/dua-lipa-porsche-911-gt3-rs-rm-sothebys-auction-info,0.0
2025-07-17T03:21:00Z,Time and price correction likely; earnings recovery in H2 could be trigger for next up move: Sanjay H Parekh,Sanjay H Parekh of Sohum Asset Managers anticipates market improvements in the second half. He expects lower interest rates and good monsoons to boost earnings from Q3. Parekh notes strong balance sheets but considers current valuations fair. He suggests pote…,https://economictimes.indiatimes.com/markets/expert-view/time-and-price-correction-likely-earnings-recovery-in-h2-could-be-trigger-for-next-up-move-sanjay-h-parekh/articleshow/122577627.cms,0.0
2025-07-17T03:30:00Z,"ETMarkets Smart Talk | Fixed income remains relevant, but corporate bonds favoured: Joseph Thomas","Emkay Wealth Management suggests shifting focus to corporate bonds and credit risk funds for better yields as gilt fund rallies peak. The Indian market shows strong growth potential, particularly in mid and small-cap segments, driven by a recovering GDP. Inve…",https://economictimes.indiatimes.com/markets/bonds/etmarkets-smart-talk-fixed-income-remains-relevant-but-corporate-bonds-favoured-joseph-thomas/articleshow/122610883.cms,0.1785714285714285
2025-07-17T03:30:00Z,"ETMarkets Smart Talk | Fixed income remains relevant, but corporate bonds favoured: Joseph Thomas","Emkay Wealth Management suggests shifting focus to corporate bonds and credit risk funds for better yields as gilt fund rallies peak. The Indian market shows strong growth potential, particularly in mid and small-cap segments, driven by a recovering GDP. Inve…",https://economictimes.indiatimes.com/markets/bonds/etmarkets-smart-talk-fixed-income-remains-relevant-but-corporate-bonds-favoured-joseph-thomas/articleshow/122555452.cms,0.1785714285714285
2025-07-17T03:32:23Z,"Shai Gilgeous-Alexander, Simone Biles Among Top Winners at 2025 ESPY Awards","Comedian Shane Gillis hosted the awards ceremony, presented by ESPN, on Wednesday night live from The Dolby Theater in Los Angeles.",http://www.hollywoodreporter.com/tv/tv-news/2025-espy-awards-winners-list-1236317956/,0.5
2025-07-17T03:40:02Z,金の買取価格は今後上がる？売るべきタイミングを紹介！,"[株式会社メディアグロース]
[画像1: https://prcdn.freetls.fastly.net/release_image/74256/17/74256-17-5dfcf4ef2729afc00e5d092f60a8819d-1280x880.jpg?width=536&quality=85%2C75&format=jpeg&auto=webp&fit=bounds&amp...",https://prtimes.jp/main/html/rd/p/000000017.000074256.html,0.0
2025-07-17T03:43:00Z,Bitget Joins Ondo’s Global Markets Alliance to Expand Global Access to Over Hundred Tokenized RWAs,Bitget partners with Ondo to bring tokenized U.S. stocks and ETFs to global crypto traders via the Global Markets Alliance.......,https://www.globenewswire.com/news-release/2025/07/17/3116938/0/en/Bitget-Joins-Ondo-s-Global-Markets-Alliance-to-Expand-Global-Access-to-Over-Hundred-Tokenized-RWAs.html,0.0
2025-07-17T03:46:05Z,Lindsey Vonn's ESPYs Underwear Was Too Chic To Keep Hidden,The ski queen let her unmentionables make an appearance during the most glamorous night in sports.,https://www.huffpost.com/entry/lindsey-vonn-espy-underwear-red-carpet_n_68786060e4b09816d315e4d4,-0.1666666666666666
2025-07-17T03:46:07Z,Push to make Gold Coast Australia's Silicon Valley for health tech,A development group says the Gold Coast's tech sector is contributing almost as much to the city's economy as tourism and efforts are underway to increase that growth.,https://www.abc.net.au/news/2025-07-17/gold-coast-health-tech-sector-growth/105537538,0.0
2025-07-17T03:51:11Z,"Biles, SGA, Eagles capture top honors at ESPYS","Olympic champion gymnast Simone Biles and NBA Finals MVP Shai Gilgeous-Alexander took home top athlete honors, while the Super Bowl champ Eagles won best team at Wednesday night's ESPYS.",https://www.espn.com/espn/story/_/id/45759152/biles-gilgeous-alexander-eagles-win-top-honors-2025-espys,0.5
2025-07-17T03:52:33Z,What the experts are saying about this week's record breaking Bitcoin price,"Leading experts dig into what’s sending Bitcoin to new all-time highs.
The post What the experts are saying about this week's record breaking Bitcoin price appeared first on The Motley Fool Australia.",https://www.fool.com.au/2025/07/17/what-the-experts-are-saying-about-this-weeks-record-breaking-bitcoin-price/,0.0
2025-07-17T03:55:51Z,"2025 ESPY Awards: 5 Best-dressed stars who dominated the red carpet, Suni Lee and more","The 2025 ESPY Awards in Los Angeles saw athletes shine both in accomplishment and style. Suni Lee's gold gown set the tone, while Lindsey Vonn and Ilona Maher impressed with daring looks. Simone Biles and Jonathan Owens coordinated in stunning fashion, and Jo…",https://timesofindia.indiatimes.com/sports/international-sports/2025-espy-awards-5-best-dressed-stars-who-dominated-the-red-carpet-suni-lee-and-more/articleshow/122611348.cms,0.25
2025-07-17T03:55:51Z,Deadmans Curse S03E01 1080p WEB h264-BAWD,"Season 3, Episode 01 – ""The Return To The Lost Mine""In Deadman's Curse, former MMA fighter and prospector Kru Williams and young Indigenous explorer Taylor Starr join seasoned legend hunter and mountaineer Adam Palmer to finally solve the mystery of Slumach's…",https://post.rlsbb.ru/deadmans-curse-s03e01-1080p-web-h264-bawd/,0.0
2025-07-17T04:00:03Z,Fratello Talks: The Best Watches Of 2025 So Far,"In case you haven’t noticed, the first half of the year is already behind us. What better time to look back at some of the best watches of 2025 so far? That’s precisely what RJ, Daan, and Nacho are doing on today’s episode of Fratello Talks. The past six mont…",https://www.fratellowatches.com/fratello-talks-the-best-watches-of-2025-so-far/,0.55
2025-07-23T21:00:00Z,All 8 Actors Who’ve Played Captain James T. Kirk In Star Trek,"Captain James T. Kirk is undeniably one of the most legendary leaders in sci-fi, and Star Trek‘s original starship captain continues to impact the franchise across every era. Whether you were first introduced to him through Star Trek: The Original Series, J.J…",http://comicbook.com/tv-shows/news/every-actor-who-played-captain-james-t-kirk-in-star-trek/,0.0
2025-07-23T21:00:00Z,Dundee Precious Metals Announces Filing of Management Information Circular for Acquisition of Adriatic Metals & Name Change,"TORONTO, July 23, 2025 (GLOBE NEWSWIRE) -- Dundee Precious Metals Inc. (TSX: DPM) (“DPM”) is pleased to announce that it has filed its management information circular and related voting materials (collectively, the “Meeting Materials”) in connection with a sp…",https://www.globenewswire.com/news-release/2025/07/23/3120669/0/en/Dundee-Precious-Metals-Announces-Filing-of-Management-Information-Circular-for-Acquisition-of-Adriatic-Metals-Name-Change.html,0.5
2025-07-23T21:00:13Z,Nike Goes Country With Some Stylish Belts & Buckles,"Nike is set to re?ignite a storied chapter in its design vault with the highly?anticipated return of the Nike Country…
The post Nike Goes Country With Some Stylish Belts & Buckles appeared first on Nice Kicks.",https://www.nicekicks.com/nike-goes-country-belts-buckles/,0.5
2025-07-23T21:01:00Z,First Quantum Minerals Reports Second Quarter 2025 Results,"(In United States dollars, except where noted otherwise)            TORONTO, July  23, 2025  (GLOBE NEWSWIRE) -- First Quantum Minerals Ltd. (“First......",https://www.globenewswire.com/news-release/2025/07/23/3120670/0/en/First-Quantum-Minerals-Reports-Second-Quarter-2025-Results.html,0.125
2025-07-23T21:02:50Z,First Quantum Minerals Reports Second Quarter 2025 Results,"(In United States dollars, except where noted otherwise) TORONTO, July 23, 2025 (GLOBE NEWSWIRE) — First Quantum Minerals Ltd. (“First Quantum” or the “Company”) (TSX: FM) today reports results for the three and six months ended June 30, 2025 (“Q2 2025” or th…",https://financialpost.com/globe-newswire/first-quantum-minerals-reports-second-quarter-2025-results,0.125
2025-07-23T21:03:26Z,Guitarist Jimmy Rogers played a part in every era of Chicago blues,"If you remember the Secret History of Chicago Music’s Winter Blues series, you know I used to cover the blues mostly in the dark, icy months. Lately, every month has felt pretty dark, as our country falls deeper into fascism and escalates its war on the disen…",http://chicagoreader.com/music/jimmy-rogers-blues-guitar-muddy-chess/,0.0
2025-07-23T21:03:35Z,Dundee Precious Metals Announces Filing of Management Information Circular for Acquisition of Adriatic Metals & Name Change,"(Unless otherwise noted, all dollar amounts in this release are expressed in U.S dollars.) TORONTO, July 23, 2025 (GLOBE NEWSWIRE) — Dundee Precious Metals Inc. (TSX: DPM) (“DPM”) is pleased to announce that it has filed its management information circular an…",https://financialpost.com/globe-newswire/dundee-precious-metals-announces-filing-of-management-information-circular-for-acquisition-of-adriatic-metals-name-change,0.5
2025-07-23T21:03:40Z,"Taylor Swift to Get 13 New Madame Tussauds Wax Figures Across The World, First Photos & Cities Revealed!",Taylor Swift has been given the wax figure treatment once again with 13 new figures launching at Madame Tussauds! The 35-year-old musician The Eras Tour looks will be seen on display across the world in the brand’s largest launch to date – and they’ll be in 1…,https://www.justjared.com/2025/07/23/taylor-swift-to-get-13-new-madame-tussauds-wax-figures-across-the-world-first-photos-cities-revealed/,0.22443181818181818
2025-07-23T21:05:13Z,"Ex-Marty Dickerson, 352-Powered 1957 Ford Ranchero","This 1957 Ford Ranchero was previously owned by AMA Motorcycle Hall of Fame member and former record-holder Marty Dickerson, who is said to have acquired the truck in the 1950s. It was subsequently fitted with a 352ci V8 and then a retrofitted three-speed aut…",https://bringatrailer.com/listing/1957-ford-ranchero-25/,0.0
2025-07-23T21:08:27Z,‘Clive Barker’s Hellraiser: Revival’ Video Game in the Works (Gaming News Roundup),"A video game based on Clive Barker’s “Hellraiser” franchise is in development from Saber Interactive and Boss Team Games. Titled “Clive Barker’s Hellraiser: Revival,” the single-player, survival horror action game marks the first-ever video game based on the …",https://variety.com/2025/gaming/news/hellraiser-video-game-gaming-news-roundup-1236468281/,-0.4
2025-07-23T21:08:51Z,How Finland’s Iconic Jewelry House Kalevala Found Its Future In Myth,"Discover how Finland’s Kalevala blends myth, sustainability, and design innovation to become one of the global leaders in ethical, female-led jewelry businesses.",https://www.forbes.com/sites/stephanrabimov/2025/07/23/how-finlands-iconic-jewelry-house-kalevala-found-its-future-in-myth/,0.25
2025-07-23T21:10:00Z,Port Royal: The Rise and (Literal) Fall of a Booming Pirate City,"Port Royal, Jamaica was a haven for pirates and privateers—until it was swallowed by the sea. 
Listen and subscribe on Apple Podcasts, Spotify, and all major podcast apps.



Baudelaire Ceus: If you’ve ever seen the first Pirates of the Caribbean, you might …",https://www.atlasobscura.com/articles/podcast-sunken-pirate-city-port-royal,0.0
2025-07-23T21:11:22Z,The LSU football community reacts to retirement of former star Tyrann Mathieu,"Former LSU football star called it a career this week, announcing his retirement from the NFL. Mathieu was a Heisman finalist while at LSU.",https://lsutigerswire.usatoday.com/story/sports/college/lsu/football/2025/07/23/lsu-football-tyrann-mathieu-retiring-nfl/85339764007/,0.0
2025-07-23T21:20:14Z,1974 Honda CL450 Scrambler at No Reserve,"This 1974 Honda CL450 Scrambler is said to have remained with a single owner in Pennsylvania from new until the current owner's acquisition in 2009. Finished in Candy Sapphire Blue with white and black graphics, the motorcycle is powered by an air-cooled 444c…",https://bringatrailer.com/listing/1974-honda-cl450-scrambler-4/,0.0
2025-07-23T21:21:07Z,"S&P/TSX composite closes higher, U.S. markets up after U.S.-Japan trade deal","TORONTO — Gains in consumer and financial stocks helped lift Canada’s main stock index to finish higher Wednesday, while U.S. markets reached new highs after the announcement of a U.S.-Japan trade deal. The S&P/TSX composite index was up 51.98 points at 27,41…",https://financialpost.com/pmn/sp-tsx-composite-closes-higher-u-s-markets-up-after-u-s-japan-trade-deal,0.25
2025-07-23T21:22:05Z,Bleeding Cool Walks Round The IDW Booth At San Diego Comic-Con Early,"IDW Publishing have arrived at San Diego Comic-Con 2025 early, well, it is their local show after all, located just up the highway. And Bleeding Cool got an early walk around their booth courtesy of IDW and the SDCC press people, with Bleeding Cool ace report…",https://bleedingcool.com/comics/bleeding-cool-walks-round-the-idw-booth-at-san-diego-comic-con-early/,0.08333333333333333
2025-07-23T21:23:13Z,Tempest Layer Banandium Gem locations in Donkey Kong Bananza,"The Tempest Layer is the ninth layer you’ll visit in Donkey Kong Bananza, and like all the others, it’s full of Banandium Gems. You’ll need to make use of the Elephant Bananza you get on this layer to grab a ton of them, which are locked behind the new mechan…",https://www.polygon.com/donkey-kong-bananza-guides-dk/615024/tempest-layer-banandium-gem-golden-banana-locations-list-map-all,0.0
2025-07-23T21:23:32Z,Landfill Layer Banandium Gem locations in Donkey Kong Bananza,"In Donkey Kong Bananza, the Landfill Layer is the tenth layer and it’s full of, well, trash. But scattered amid the rubbish is a bunch of Banandium Gems. Inside this heap of garbage, you’ll need to search behind metal scrap, dirt, and loads of debris to to co…",https://www.polygon.com/donkey-kong-bananza-guides-dk/615331/landfill-layer-banandium-gem-golden-banana-locations-list-map-all,0.0
2025-07-23T21:24:04Z,WNBA legend Candace Parker insists 'no hate' towards Angel Reese after assigning Sky star middling grade,The three-time WNBA champion's player rankings continue to spark reaction,https://www.cbssports.com/wnba/news/wnba-legend-candace-parker-insists-no-hate-towards-angel-reese-after-assigning-sky-star-middling-grade/,0.4
2025-07-23T21:30:00Z,Read Dustin Poirier’s ‘Letter To The Game’,"UFC superstar Dustin Poirier stepped into the Octagon for his final fight at UFC 318, falling to Max Holloway via unanimous decision and has released a ‘letter to the game’",https://www.mmamania.com/2025/7/23/24473275/diamond-out-dustin-poirier-releases-emotional-letter-to-the-game-just-days-after-ufc-retirement,-0.4
2025-07-23T21:32:18Z,The Commodore 64 Was a Revolutionary Gaming Computer and Now It’s Getting a Second Chance,"Available in three editions, the '80s icon is being revived with welcomed modern tech.",https://hiconsumption.com/tech/commodore-64-ultimate/,0.0
2025-07-23T21:33:06Z,Pearl-Accented Modern Jewelry Collections - Ecksand's Wonder Pearl Collection is Stunning & Elegant (TrendHunter.com),(TrendHunter.com) Ecksand's Wonder Pearl Collection represents a significant evolution in the Montreal-based maison's design philosophy as the brand moves to merge its foundational pearl heritage with contemporary...,https://www.trendhunter.com/trends/wonder-pearl,0.39999999999999997
2025-07-23T21:36:57Z,[Catholic Caucus] Close the Workshop: Why the Old Mass Isn’t Broken and the New Mass Can’t be Fixed,"[Catholic Caucus] Close the Workshop: Why the Old Mass Isn’t Broken and the New Mass Can’t be FixedIf we are well past the days when it was common for faithful Catholics to become unhinged at the very suggestion of “fixing” the Missal of Paul VI, we must admi…",https://freerepublic.com/focus/f-religion/4330370/posts,-0.012727272727272736
2025-07-23T21:45:00Z,Spike-Toothed Worm and Other Creatures Lived in Grand Canyon 500 Million Years Ago,Learn how the Grand Canyon used to be home to an ancient evolutionary competition that has since left behind a plethora of soft-bodied fossils.,https://www.discovermagazine.com/the-sciences/spike-toothed-worm-and-other-creatures-lived-in-grand-canyon-500-million,0.1875
2025-07-23T21:45:52Z,Jeff Passan calls Padres best fit for $50 million White Sox slugger,ESPN MLB insider Jeff Passan calls the San Diego Padres the best fit for $50 million White Sox slugger.,https://www.sportingnews.com/us/mlb/san-diego-padres/news/jeff-passan-padres-best-fit-50-million-white-sox-slugger/a71555d4896673c572bd1adc,0.4666666666666666
2025-07-23T21:47:54Z,"Woman Was Extra Annoying When She Got Engaged, And Then When Her Coworker Got Engaged, She Started Crying",Engagement ring revenge isn't the best way to start a marriage.,http://twistedsifter.com/2025/07/woman-was-extra-annoying-when-she-got-engaged-and-then-when-her-coworker-got-engaged-she-started-crying/,-0.3333333333333333
2025-07-23T21:55:24Z,Superheated gold withstands 'entropy catastrophe': New method challenges established physics - Phys.org,Superheated gold withstands 'entropy catastrophe': New method challenges established physicsPhys.org Superheating gold beyond the predicted entropy catastrophe thresholdNature Superheated Gold Hits Temperatures Higher Than the Sun’s Surface—Without MeltingSci…,https://slashdot.org/firehose.pl?op=view&amp;id=178450348,0.13636363636363635
